{
  "author" : "someone@company.com",
  "commentText" : "Hello, this is a comment!",
  "requestDelete" : true,
  "simulationId" : "473ea5F8-59fe-d7Bb-1EDE-Fcae4CA19878",
  "objectType" : "urn:samm:io.catenax.week_based_capacity_group",
  "postedAt" : "2023-03-10T12:27:11.320Z",
  "listOfReferenceDates" : [ "2023-11-05" ],
  "supplier" : "BPNL6666666666YY",
  "commentType" : "information",
  "commentId" : "f5c151e4-30b5-4456-94fd-2a7b559b6121",
  "changedAt" : "2023-03-10T12:27:11.320Z",
  "objectId" : "dfeb1334-497e-4dab-97c1-4e6f4e1c0320",
  "customer" : "BPNL8888888888XX"
}